{
  "binary": {
    "architecture": "MIPS",
    "compiler_spec_id": "default",
    "image_base": "0x400000",
    "language_id": "MIPS:BE:32:default",
    "name": "toy_10",
    "path": "/home/kali/projects/neuro-symbolic-iot-aeg/datasets/toy_cgi/build_cross/mips/toy_10"
  },
  "dangerous_sinks": [
    {
      "address": "0x400810",
      "callers": [
        "main"
      ],
      "callsites": [
        {
          "address": "0x400810",
          "caller": "main",
          "caller_entry": "0x4007a0"
        }
      ],
      "category": "memory_copy",
      "description": "Copies bytes from a source buffer into a destination buffer.",
      "external_address": "0x4",
      "imported": true,
      "name": "memcpy",
      "source": "import"
    },
    {
      "address": "0x400830",
      "callers": [
        "main"
      ],
      "callsites": [
        {
          "address": "0x400830",
          "caller": "main",
          "caller_entry": "0x4007a0"
        }
      ],
      "category": "command_execution",
      "description": "Executes a shell command string supplied by the caller.",
      "external_address": "0x2",
      "imported": true,
      "name": "system",
      "source": "import"
    }
  ],
  "decompiled_snippets": [
    {
      "entry": "0x4007a0",
      "function": "main",
      "text": "\nint main(int argc,char **argv)\n\n{\n  int iVar1;\n  uint uVar2;\n  char **argv_local;\n  char *ip;\n  char cmd [64];\n  \n  iVar1 = *(int *)PTR___stack_chk_guard_00411048;\n  if (1 < argc) {\n    (*(code *)PTR_memcpy_0041104c)(cmd,argv[1],0x20);\n    cmd[0x20] = '\\0';\n    (*(code *)PTR_system_00411040)(cmd);\n  }\n  uVar2 = (uint)(1 >= argc);\n  if (iVar1 != *(int *)PTR___stack_chk_guard_00411048) {\n    (*(code *)PTR___stack_chk_fail_00411044)();\n  }\n  return uVar2;\n}\n\n"
    },
    {
      "entry": "0x40057c",
      "function": "_init",
      "text": "\nint _init(EVP_PKEY_CTX *ctx)\n\n{\n  int iVar1;\n  \n  if (PTR___gmon_start___0041103c != (undefined *)0x0) {\n    (*(code *)PTR___gmon_start___0041103c)();\n  }\n  (*(code *)(PTR___DT_MIPS_BASE_ADDRESS_0041102c + 0x794))();\n  iVar1 = (*(code *)(PTR___DT_MIPS_BASE_ADDRESS_0041102c + 0x890))();\n  return iVar1;\n}\n\n"
    },
    {
      "entry": "0x400600",
      "function": "__start",
      "text": "\nvoid processEntry __start(undefined4 param_1,undefined4 param_2)\n\n{\n  undefined1 auStack_20 [16];\n  undefined4 local_10;\n  undefined4 local_c;\n  undefined1 *local_8;\n  \n  local_8 = auStack_20;\n  local_10 = 0;\n  local_c = param_1;\n  (*(code *)PTR__MIPS_STUBS__00411054)(PTR_main_00411028,param_2,&stack0x00000004,0);\n  do {\n                    /* WARNING: Do nothing block with infinite loop */\n  } while( true );\n}\n\n"
    },
    {
      "entry": "0x400660",
      "function": "deregister_tm_clones",
      "text": "\n/* WARNING: Removing unreachable block (ram,0x00400678) */\n/* WARNING: Removing unreachable block (ram,0x00400688) */\n\nvoid deregister_tm_clones(void)\n\n{\n  return;\n}\n\n"
    },
    {
      "entry": "0x400698",
      "function": "register_tm_clones",
      "text": "\n/* WARNING: Removing unreachable block (ram,0x004006c4) */\n/* WARNING: Removing unreachable block (ram,0x004006d4) */\n\nvoid register_tm_clones(void)\n\n{\n  return;\n}\n\n"
    },
    {
      "entry": "0x4006e4",
      "function": "__do_global_dtors_aux",
      "text": "\n/* WARNING: Removing unreachable block (ram,0x00400740) */\n\nvoid __do_global_dtors_aux(void)\n\n{\n  if (completed_1 == '\\0') {\n    deregister_tm_clones();\n    completed_1 = '\\x01';\n  }\n  return;\n}\n\n"
    },
    {
      "entry": "0x400794",
      "function": "frame_dummy",
      "text": "\n/* WARNING: Removing unreachable block (ram,0x004006c4) */\n/* WARNING: Removing unreachable block (ram,0x004006d4) */\n\nvoid frame_dummy(void)\n\n{\n  return;\n}\n\n"
    },
    {
      "entry": "0x400890",
      "function": "__do_global_ctors_aux",
      "text": "\nvoid __do_global_ctors_aux(void)\n\n{\n  undefined4 *puVar1;\n  code *pcVar2;\n  \n  if (__CTOR_LIST__ != (code *)0xffffffff) {\n    puVar1 = &__CTOR_LIST__;\n    pcVar2 = __CTOR_LIST__;\n    do {\n      puVar1 = puVar1 + -1;\n      (*pcVar2)();\n      pcVar2 = (code *)*puVar1;\n    } while (pcVar2 != (code *)0xffffffff);\n    return;\n  }\n  return;\n}\n\n"
    },
    {
      "entry": "0x4008f0",
      "function": "_MIPS_STUBS_",
      "text": "\nvoid _MIPS_STUBS_(void)\n\n{\n  (*(code *)_GLOBAL_OFFSET_TABLE_)();\n  (*(code *)_GLOBAL_OFFSET_TABLE_)();\n  (*(code *)_GLOBAL_OFFSET_TABLE_)();\n  (*(code *)_GLOBAL_OFFSET_TABLE_)();\n  (*(code *)(PTR___DT_MIPS_BASE_ADDRESS_0041102c + 0x6e4))();\n  return;\n}\n\n"
    },
    {
      "entry": "0x400900",
      "function": "memcpy",
      "text": "\n/* WARNING: Unknown calling convention -- yet parameter storage is locked */\n\nvoid * memcpy(void *__dest,void *__src,size_t __n)\n\n{\n  void *pvVar1;\n  \n  (*(code *)_GLOBAL_OFFSET_TABLE_)();\n  (*(code *)_GLOBAL_OFFSET_TABLE_)();\n  (*(code *)_GLOBAL_OFFSET_TABLE_)();\n  pvVar1 = (void *)(*(code *)(PTR___DT_MIPS_BASE_ADDRESS_0041102c + 0x6e4))();\n  return pvVar1;\n}\n\n"
    },
    {
      "entry": "0x400910",
      "function": "__stack_chk_fail",
      "text": "\nvoid __stack_chk_fail(void)\n\n{\n  int unaff_gp;\n  \n  (**(code **)(unaff_gp + -0x7ff0))();\n  (**(code **)(unaff_gp + -0x7ff0))();\n  (*(code *)(PTR___DT_MIPS_BASE_ADDRESS_0041102c + 0x6e4))();\n  return;\n}\n\n"
    },
    {
      "entry": "0x400920",
      "function": "system",
      "text": "\n/* WARNING: Unknown calling convention -- yet parameter storage is locked */\n\nint system(char *__command)\n\n{\n  int iVar1;\n  int unaff_gp;\n  \n  (**(code **)(unaff_gp + -0x7ff0))();\n  iVar1 = (*(code *)(PTR___DT_MIPS_BASE_ADDRESS_0041102c + 0x6e4))();\n  return iVar1;\n}\n\n"
    },
    {
      "entry": "0x400940",
      "function": "_fini",
      "text": "\nvoid _fini(void)\n\n{\n  (*(code *)(PTR___DT_MIPS_BASE_ADDRESS_0041102c + 0x6e4))();\n  return;\n}\n\n"
    },
    {
      "entry": "0x412000",
      "function": "_ITM_registerTMCloneTable",
      "text": "\n/* WARNING: Control flow encountered bad instruction data */\n\nvoid _ITM_registerTMCloneTable(void)\n\n{\n                    /* WARNING: Bad instruction - Truncating control flow here */\n  halt_baddata();\n}\n\n"
    },
    {
      "entry": "0x412004",
      "function": "__gmon_start__",
      "text": "\n/* WARNING: Control flow encountered bad instruction data */\n\nvoid __gmon_start__(void)\n\n{\n                    /* WARNING: Bad instruction - Truncating control flow here */\n  halt_baddata();\n}\n\n"
    },
    {
      "entry": "0x41200c",
      "function": "_ITM_deregisterTMCloneTable",
      "text": "\n/* WARNING: Control flow encountered bad instruction data */\n\nvoid _ITM_deregisterTMCloneTable(void)\n\n{\n                    /* WARNING: Bad instruction - Truncating control flow here */\n  halt_baddata();\n}\n\n"
    }
  ],
  "externals": [
    {
      "address": "0x6",
      "external": true,
      "name": "_ITM_deregisterTMCloneTable",
      "namespace": "<EXTERNAL>"
    },
    {
      "address": "0x7",
      "external": true,
      "name": "_ITM_registerTMCloneTable",
      "namespace": "<EXTERNAL>"
    },
    {
      "address": "0x1",
      "external": true,
      "name": "__gmon_start__",
      "namespace": "<EXTERNAL>"
    },
    {
      "address": "0x5",
      "external": true,
      "name": "__libc_start_main",
      "namespace": "<EXTERNAL>"
    },
    {
      "address": "0x3",
      "external": true,
      "name": "__stack_chk_fail",
      "namespace": "<EXTERNAL>"
    },
    {
      "address": "0x4",
      "external": true,
      "name": "memcpy",
      "namespace": "<EXTERNAL>"
    },
    {
      "address": "0x2",
      "external": true,
      "name": "system",
      "namespace": "<EXTERNAL>"
    }
  ],
  "extraction": {
    "errors": [],
    "exporter": "ns_aeg.ghidra.export_facts:0.1",
    "ghidra_available": true,
    "mode": "pyghidra",
    "status": "ok",
    "warnings": [
      "pyghidra backend: installed (/home/kali/projects/neuro-symbolic-iot-aeg/.venv/lib/python3.10/site-packages/pyghidra/__init__.py)"
    ]
  },
  "functions": [
    {
      "entry": "0x40057c",
      "name": "_init"
    },
    {
      "entry": "0x400600",
      "name": "__start"
    },
    {
      "entry": "0x400660",
      "name": "deregister_tm_clones"
    },
    {
      "entry": "0x400698",
      "name": "register_tm_clones"
    },
    {
      "entry": "0x4006e4",
      "name": "__do_global_dtors_aux"
    },
    {
      "entry": "0x400794",
      "name": "frame_dummy"
    },
    {
      "entry": "0x4007a0",
      "name": "main"
    },
    {
      "entry": "0x400890",
      "name": "__do_global_ctors_aux"
    },
    {
      "entry": "0x4008f0",
      "name": "_MIPS_STUBS_"
    },
    {
      "entry": "0x400900",
      "name": "memcpy"
    },
    {
      "entry": "0x400910",
      "name": "__stack_chk_fail"
    },
    {
      "entry": "0x400920",
      "name": "system"
    },
    {
      "entry": "0x400940",
      "name": "_fini"
    },
    {
      "entry": "0x412000",
      "name": "_ITM_registerTMCloneTable"
    },
    {
      "entry": "0x412004",
      "name": "__gmon_start__"
    },
    {
      "entry": "0x41200c",
      "name": "_ITM_deregisterTMCloneTable"
    }
  ],
  "imports": [
    {
      "address": "0x6",
      "external": true,
      "name": "_ITM_deregisterTMCloneTable",
      "namespace": "<EXTERNAL>"
    },
    {
      "address": "0x7",
      "external": true,
      "name": "_ITM_registerTMCloneTable",
      "namespace": "<EXTERNAL>"
    },
    {
      "address": "0x1",
      "external": true,
      "name": "__gmon_start__",
      "namespace": "<EXTERNAL>"
    },
    {
      "address": "0x5",
      "external": true,
      "name": "__libc_start_main",
      "namespace": "<EXTERNAL>"
    },
    {
      "address": "0x3",
      "external": true,
      "name": "__stack_chk_fail",